Review Count,title,rating,x
365,Nice Product,5,"Stable IPhone product, Package was quality. Delivery guy was supportive. Amazon needs to provide some more details like new or old version. Good battery life value for money.Xr doesn't have finger scanner only face scanner. Few câmara features lagging but overall good."
366,Thank you Amazon for the most trusted delivery,5,
367,A decent Ios device.,5,"Arrived a day earlier than scheduled and the product was original. Working fine till now and overall, a reasonably priced decent smartphone. There has to be a little upgradation needed in the camera quality. But for those who are not very particular about that, it is a nice phone with a adequate bat"
368,Tremendous value,5,"If you want to buy this device, be prepared for the lack of a full HD Amoled screen, Ultrawide camera, Night mode and slim bezels. If you are ok with all these omissions, you will get a silky smooth iOS experience, good performance, tons of privacy and security features, solid battery life and excel"
369,Fantastic,5,"Of all the fruits that I love, apple is the best. Jokes apart, this is a refreshing experience in terms of battery performance. So smooth .. so buttery. You will fall in love with this .. it’s been 3 years since it’s launch, it still sells! Once an Applian, always an Applian."
370,Great iPhone to start with,5,"So this is my first iPhone since I moved from Android. The interface is different and mildly perplexing but you will get used to it eventually. The camera quality is great- no doubt about that. However my major praise is battery life. I haven’t used the phone for gaming, still I am able to get aroun"
371,Superb,5,Superb
372,Budget friendly basic i phone,5,"The product is very good and well suited for you if you don't use camera a lot and just a fan of IOS UI. It's a very budget friendly iphone and works extremely good in 2021 also.I was just worried about the genuineness of the product as negetive reviews missguides you a lot, but i am happy to receiv"
373,Worth for Money,5,"Even though this model released on 2018, still this is a worth for money even on 2022. Best in hardware and best on OS. It’s best in value for money."
374,Beat,5,Don’t think that it’s old iPhone just go for it if you never use iPhone because there is slight difference between XR And iPhone 11
375,Good,5,Excellent
376,Just Wow!!,5,"Was contemplating whether to go with SE 2 or XR. Finally, went ahead with XR. Great features, Awesome Camera and Long lasting battery for my kind of usage. No need to tell about build quality or the software, they are the BEST!! I am thoroughly satisfies with the purchase."
377,Awesome,5,Value for money
378,Iphone xr no 1 mobile,5,Best
379,Best phone under 32K,5,"Reviewing after 2 months usage till date no issues, camera is great even though it's single camera, sound quality really superior battery backup also not bad over all great buy"
380,Don’t focus on negative reviews,5,There are so many negative reviews for this product and I was bit scared too while ordering this product.But I received my iPhone in perfectly fine condition.Totally happy with the service.Enjoying iOS??????
381,Beast phone in 2022 too,5,"If you are a non gamer, just go for it. Gaming is also good in this with zero lag. But the battery life might be unstable. This is the best value for money apple had ever made. Disclaimer : don’t upgrade from iOS 14 to experience better performance and battery life"
382,Battery backup is good,5,All for official work battery is having good life
383,One of the best iPhone ever produced by Apple.,5,"Good product, Apple should not discontinue this product."
384,Dad is very happy :),5,Bought it for my dad as he was looking to own an apple device for a long time. Pleased to say he is very happy with the device. The colour option was to his liking as well which was a bonus. Happy days :)
385,Worth buying even in 2022,5,Writing this review after 1month of usage and it’s still worth buying even in 2022 ( if u don’t have issues with 5g :) it’s design doesn’t look outdated as it was launched 3years ago still it feels premium then the other phones in the price range! I can probably say good phone for gaming under the p
386,Still a good package,5,Still a good package at 27.5K after card discount & exchange. Camera still a shade better in most situations than most phones in this range. Go for it ??
387,Amazing offer,5,Good product at amazing price.
388,Genuine product.,5,"Awesome phone. Was worried until it got delivered. 100% Genuine product. I think 31-33k is the best price for xr now. Xr is still a great phone in 2022. Though it's camera is not upto mark, I'm satisfied with its performance. It will do more better if apple gives a good software update. Although it'"
389,Dont be scared,5,I bought this in December and its been working great. It is a brand new phone.No laggingBattery is amazingCamera is obviously good but in low light its v grainyThe box includes the cable not the adapter.
390,Budget iPhone,5,iPhone 5Camera 3Battery 4Display 3Size 3 fatCharger 2 only type cCharging 3 speed
391,Original and excellent mobile,5,"I like everything in iphone xr. Decent Battery back up. I'm not a heavy game user. I have iphone se 2020 which battery backup is very pathetic though it's camera quality is pretty good in comparison to XR. I have 128 gb and I bought it at Rs.28,000/- only without adapter and earphone."
392,Best most selling iPhone,5,"Really statisfied with the product this is my 2nd apple device i was really nervous about this product before buying ,as there are lots of negative reviews but my brain is fully positive to purchase this product and i am finally bought it"
393,Genuine apple products,5,"Genuine Apple products,Good battery life ,Overall good,Camera quality average, this product is not for camera or selfie lover."
394,Very good and no complaints,5,Nothing to complain here completely satisfied with my XR
395,Finally,5,Red Colour is beautiful finishing is absolutely good. Best iphone if u are really looking for a iphone in budget then u can go for this phone.
396,Best phone for average users. I love it.,5,Best phone ever. Even at 2021 it’s great. Bit slow though display is not that great and camera is also below par at this price point. But for average users it’s an great asset.
397,The dealer is trusted and safe,5,"I got delivery the next day and at first phone was not turning on at all. Everyone who faces this issue, it’s only for the first time because the device has no charging. I recommend buy a charger offline before hand only. Otherwise, phone is completely genuine and and too good."
398,"Absolutely Perfect, love it",5,"The product sold was genuine and fantastic, everything is awesome. It's been 3 months now, I'm very satisfied with the product. Good purchase it is, money well spent."
399,"Awsm device, must say ????",5,"Old is gold, awsm device, impeccable design and camera, must say this is still very much in thing, only issue no power adaptor in the box"
400,Value for money in iphone series.,5,The phone is best as it carries all new features for new iphone. Its little bulky as compared to other iphone models.
401,One word is enough - Super ?,5,"Apple always gives best phones. Again a super fast XR, camera quality exceptional ??. Love this product."
402,Awesome...forgot about negative reviews,5,Excellent and I received package as shown on picture. No damages....
403,All time Dream achieved,5,Nice product with superb optimised. I was an android user. but now onwards iphone makes me a fan of IOS. It’s really cool & face recognition was fantastic. And overall performance at its extreme!!!
404,Excellent phone,5,Good phone…only 34 k same feeling like big iPhone mobile. Camara performance is superb need not carry DSLR camera. Overall experience is excellent and I am happy to purchase this product..
405,All good,5,"I bought XR RED in 2019 , again bought now in 2021 December may be because of prices and ? iOS addiction. Still I don’t have any regret of buying XR RED"
406,Superb,5,It is really nice phone even in 2021 just buy 128 gb you are all set to go just one compromise is the ultra wide shots if you can compromise for that just go for it
407,Great iPhone,5,Works very smooth & enriched with all apple features.It's genuine device of apple & warranty is verifed on device.
408,Best budget iPhone ever??,5,Awesome experience what a fast processor amazing camera just amazing in everything love it soo much????????
409,Excellent,5,I am using this phone from last weak it performance is best camera is also good if u are considering this phone choose black color very shiny and beautiful
410,Value for money,5,Best camera. Miss nightmode. Battery drain little early. Overall best mobile. Value for money too.
411,Awesome,5,"Front camera not that ok, but rest all phone is fantastic on performance, Battery life, rear camera quality wise.A big Thumbs up."
412,Affordable IPhone for beginners to have handson experience,5,"Good battery life, value for money, with it"
413,It’s very osm camera excellent picture,5,This I phone XR mobile is very very super sensitive in display quality and touching sensitive is very amazing camera is very very good and osm facing unlock is very fast Rear camera is very very amazing pictures capturing……
414,Best phone,5,"while ordering online I was bit worried, but Amazon did excellent job and delivered phone in good condition...at low price"
415,Genuine product just go for it,5,Genuine product
416,Perfect product,5,I was little tensed about the fake products because i ordered my xr for 34k and i saw the reviews that amazon selling clone iphones and damaged products but i took a step forward and waited for mine and i got genuine and i am happy
417,Good,5,My battery drained 100 to 94% in just 3 months I think Amazon have provide me refurbished product.
418,Beast flagship phone,5,Iam very happy with colour and phone?and is best iphone in bugget.
419,Love this i phone,5,"First of all thanks amazon to give outstanding deal , secondly xr is brilliant deal on this price 40k a round best experience"
420,Apple iphone,5,Its an iphone. Bas aur kuch bolne ka jarurat nehi..
421,"Original product,go for it",5,"Original product,Thanks Amazon"
422,Amaizing phone. Great performance & battery life.,5,Totally satisfied with the battery life and performance. Its really worth. Amaizing phone by Apple Iphone XR.
423,Happy,5,Mind blowing product in budget. Thank you Amazon
424,Best purchase,5,100% satisfied with the mobile phone. It’s awesome ??
425,Best budget iPhone ever.,5,Best budget iPhone apple ever made. Go for it without hesitation. Battery life is beyond expectations.
426,Awesome,5,Supper product work good ??????
427,Good price good photo.. love it,5,Good product nice.nice phone
428,One more good product from ??,5,Nice phone at reasonable price.
429,Battery life and fast charging,5,"Amazing phone, fast charging, great battery life.If you are ok with single camera then no need to go for 11 or above. XR can serve the purpose"
430,Super phone,5,Super.better than any make of android phone.
431,Genuine Product,5,Best part was Same day delivery … Genuine product
432,Good product,5,I was scared the product would show up dysfunctional but it's working perfectly fine. Thank you amazon!
433,Go for it,5,"100% genuine product.. XR is still good.. nice display, camera quality"
434,Apple of my eye ??,5,Apple is always the best
435,Satisfied with purchace,5,Received product as per expectations.Using it from month.
436,Excellent performance,5,Have bought the second one in one year for family.Great performance with good battery life and nice camera results
437,Fully satisfied,5,Using it from a month.Android to iOS-best experienceWorth buying even in 2022.I was confused to buy it online or not. Found a genuine store:)
438,33900 price best iPhone ek no ph hai bilkul mazedaar,5,Ph bahut accha hai koi problem nahi sab cheez ek bo hai
439,"Great phone, timely delivery.",5,Phone was delivered before expected. My Dad using the phone and he absolutely loved it.
440,Excellent,5,Amazing phone for the price
441,Awsome phone and it's optimization is mind-blowing faster and smooth gaming performance,5,I phone is always good with his optimization and processer iphone xr is 3yr old but still the gaming performance and other day to day uses is Awsome
442,Very fast delivery and a very genuine seller…..,5,Amazing product and genuine seller with prompt delivery
443,obessed,5,totally worth the penny got mine today okii packaging but phone is working go for it
444,Great purchase,5,I was confused with lot of negative review s but decided to go ahead.Great phone even in 2021
445,Battery life is good,5,"Good battery life I am an hard user and need to charge two times a day,but it’s okay with the fast charger which make 0-80% in just 40min."
446,Good,5,Battery is not so good but other than that allare good
447,Works great even in 2021,5,The product was received in an intact packing and it works really well. One con is that had to buy the charging adapter separately. Still feels great to use in 2021
448,The Best,5,"This is the best buy ever, switched from android to iphone xr and I am all love ?? ."
449,Best affordable iPhone segment,5,Currently using and really satisfied with the performance and battery backup.
450,Excellent phone,5,"Disappointed for not including the charging adaptor, I had to buy seperately"
451,All as expected,5,Love it!
452,Good Mobile,5,Excellent Mobile loving it ??
453,Nothing better than it,5,Very nice
454,Good product,5,Good mobile.
455,Nice product,5,Superb product.. my 2nd iphone after iphone 6.. huge difference.. liked a lot
456,A perfect smartphone from apple,5,The beast
457,Great apple is apple,5,Osm
458,Iphone xr. Super,5,Super. Mobile. For. Gaming camera is super and. Charging. Speed is nice. Iam using 18wattfast charger sounds like monster inside best for. Bgmi. .
459,Perfect Item,5,Just as Expected.
460,Absolutel,5,Absolutely awesome even in 2021 go for it if you will
461,Outstanding phone ??,5,"Low battery backup and not have long sdcard slot otherwise phone is outstanding, mind blowing, fantastic, fabulous ??????"
462,Best battery phone,5,"Go for it, it has very strong battery"
463,Good and worth money,5,"I am update 6s to xr, but usage different, i like it"
464,??,5,??
465,Good,5,Good
466,Very Bad Battery Health,5,"Very bad battery getting hot instantly while open Instagram, gaming,hotspot and charging.Battery health drop from 100-98 in 2 months"
467,??,5,Got it for around 33k. Great value product.
468,After update bad battery life,5,After i update to 15.2 battery draining so fast. But excellent mobile if you want to apple product
469,great product,5,all is good but no charger in box...disappointed for that apple
470,One of the best iPhones so far,5,There is nothing which one can’t like about this phone I switched from 6s to xr and trust me this phone is really worth every penny.
471,Excellent Phone,5,Fantastic
472,Super phone,5,Good one
473,I just love it,5,in a cheap price Amazon provide a good Apple iPhone for me... really amazing!!
474,The best budget Iphone!!!!(BETTER PERFORMANCE/OPTIMISATION THAN ANDROID),5,If u r looking for performance and optimisation then u r in the right place!!
475,Mind blowing,5,Battery is 3000 MAH it’s very low remain all ????Camera 4/5 ??Video 4K 5/5??Perfomance ??????
476,Good deal ????,5,Working as wonder ??
477,Good Buy at a Reasonable price,5,Slightly smaller to iphone 6 plus in size but rest everything as of now looks good
478,Lovely smart phone,5,Product is awesome battery life camera quality sound quality
479,Go for it,5,
480,Go for it,5,This is a great product battery performance is not so gook it is just ok okOtherwise its a great deal
481,Best colour iphone,5,"Bful coral design ..v sturdy, bful display..XR rocks"
482,Amazing,5,Like any other Apple phone. XR does everything right
483,Power packed phone,5,power packed phone… don’t think twice before buying this phone… just go and buy it
484,It’s worth for money,5,"I appreciate the timely delivery, quality of package and performance of iPhone XR"
485,all good,5,Very good
486,Feeling like a iPhone so good ????????,5,Feeling like a iPhone so good ????????
487,Good,5,Good
488,My first new phone is very good,5,I usually used android but i want to try ios so I brought xr and it is very good and i like it.
489,Too good in this price,5,Perfect iPhone
490,I loved this phone the camera quality is very nice display is very big,5,I loved this phone the camera quality is very nice display is very big
491,Fabulous,5,Value for money
492,Good mobile before I’m using Vivo but the iPhone XR is more then better in all format,5,Battery need daily 2 times charge rest all good
493,Satisfied,5,Satisfied
494,Worth for the money given. Good product.,5,Good option for the people to buy in 35k category and product is not defective. Good supplier
495,Clarity Of Picture Is So Beautiful,5,I like the picture quality
496,It was great experience and very good phone,5,"I like the overall online process of delivery,! Thanks a ton Amazon for this best experience"
497,Awesome Purchase,5,Liked it !! Genuine Box Sealed ! Overall satisfied !
498,I phone,5,This one best product and using since 2016 huge fan of technology.
499,Cost worthy,5,"XR is obviously good iphone in best price range, also received in proper packaging"
500,Data (Internet) stopped working since a month now,5,Data (Internet) stopped working since a month now
501,this is 100 percent worth in 2022 iphone xr,5,there is no dislikes here product red is stunning looks and massive performance
502,Excellent,5,"I like the whole chain i.e. Faculty, delivery partners and the product."
503,Best powerful product in this price range,5,The best powerful product ????Best for gamingBest in camera in day lighting
504,Good product,5,Nice product.. as expected
505,good phone,5,Good phone over all
506,Nice,5,Good product
507,Dream,5,Amazing phone. Go for it. Updated to latest ios 15.1.
508,Good,5,Nice
509,Super,5,Supar
510,Best phone,5,This product is very goodNo lagFeels smooth
511,Best budget iphone,5,The packaging was good and came perfect
512,Superb,5,I recommend this
513,Iphone,5,Excellent
514,Wowwwwwwieeee,5,??
515,Awsome,5,Love to have it
516,Good Phone,5,It’s a very good phone
517,This is best phone under 33k.??????,5,
518,Everything is super,5,I like all the thing in this
519,Excellent phone,5,I like the battery life and all up to date features.
520,Great deal,5,10-Oct
521,It’s a good product,5,Purchased for wife and it is really a good product.
522,iPhone XR,5,Good product
523,Awesome,5,Prefect iphn in this range
524,A prestigious device to own,5,Great product. Really happy
525,"Superb, best in budget.",5,Extremely satisfied with the product and delivery.
526,Best apple device,5,Best camera with great too
527,Nice,5,
528,Best in my own mind.,5,Awesome quality.
529,Good product,5,I liked this product . This is soo good
530,Delivery agent inboxing my XR,5,
531,Impressive desine,5,Excellent Mobile + it's Performance massive
532,Right,5,For student life.. this is very good iPhone
533,Good phone worth for money,5,Update should be available at least 5 years
534,Super,5,
535,Best in all aspects,5,Best performance in all the areas.
536,Best phone for gaming and battery,5,Very good phone I really like it
537,Its a very nice iPhone,5,Really everything is good in this iPhone
538,Battery life,5,As on date it is good
539,Great product as expected,5,Overall happy
540,Good items,5,
541,Wroth of money ?????,5,Best iphone in cheapest Rate
542,Wrost device,5,Camera is not working wrost mobile
543,Xr worth buy in 2022 ??,5,Awesome brand new product red xr ??
544,Good product,5,Good product according to its price
545,Satisfied,5,Good product Good Performance
546,Genuine product received uploading after 2 days of using.,5,Go for it best phone.
547,Superr,5,Super
548,Very good product,5,I love this product so much
549,Excellent phone and on time delivery by Amazon,5,Value for money and quality
550,iPhone XR super,5,Very nice good iPhone XR ??
551,Best,5,Best mobile
