Review Count,title,rating,x
170,Go for it..,5,you really don't need to upgrade if you bought a new iPhone last year. But anyone with an iPhone 11 or older will find enough new parts and features to consider the new modelsScreenThe screen is notab
171,I loved it…Red color is awesome..,5,I’m happy with iPhone 13. It’s little bit heavy like iPhone 11 but it’s fine.
172,"Well, won't say anything you already don't know!",5,Missing features :High refresh rate displayTelephoto lensMacro modeOverall it's a great phone!
173,Awesome,5,Its a very pretty colour ... Very good experience in holding with hand ...Camera quality very special... I love listening music with in it... Friends don't think too much .... Thank you amazon for saf
174,New and nice experience so far,5,"New experience. First time using iPhone. Performance is outstanding but having issues regarding apps, music and videos ristricated by apple. Rest is superb."
175,I Live and Love Apple,5,"Amazing phone. I have had iPhones since launch of iPhone 4 and has most of them throughout. Still using 10, 12 and now 13.It’s amazing. Camera is just beyond excellence, which is basically what is nee"
176,Fantastic All around performance,5,"A great Iphone that ticks all the right boxes. Easy to grip in hand , excellent low light photos, fantastic battery life of more than 6 hours plus of on screen time Ona daily basis."
177,Good phone. Great camera. Amazing battery,5,"It’s a great phone. After my 6s plus, it’s an amazing upgrade but I wish I would have bought the pro version instead. I miss the features that phone has."
178,Absolute Beast! Worth Every Penny.,5,"The iPhone 13 offers great performance and exceptional battery life. It came with 3 months of free Apple TV + Apple Arcade subscription, and 1 month of free Apple Music."
179,Good,5,Very Very Good Mobile.Sad to say thing is charging adaptor is not in box.Should include adaptor in box.And screen guard and back cover is also suggested to add in the box.
180,Great product,5,Product is very good. I am happy with this product
181,Too good,5,In one word fantastic…. Beast of a performer..It good right balance of size and performanceBattery life is major USP of this mobile …Two major Cons :-120 htz refresh rate is must have for this price p
182,Its an ios very smooth especially dolby speaker are awesome,5,Previous mobile was one pluse 5 switched to i phone 13 and i am just fall in love with ios.Watch Lot of youtube videos about ios vs android and take decision to go for ios. Its super cool
183,Words Can’t explain how statisfied I’m ????,5,"I bought this phone for my ios app development & testing and the battery to performance just works fine , giving me a 7.51 hr of battery backup in full usage. Just awesome ??."
184,Top Notch high quality feel delivered,5,"Amazing phone , Amazing Battery life , Stunning camera , and the videos are like wooooow , every one is sure to ask you which device did you use to upload these premium quality videos . Battery is roc"
185,Beautiful Design,5,Nice product and gorgeous...!Very nice camera quality.Display is too good...Body is also good.Is has many hidden features than iphone 12 and 11 and all old products...
186,Awesome purchase was lucky to get a proper product without hiccups,5,Display performance and feel of the device along with the camera is top notch and perfect. Fits perfectly everywhere and screen is big enough to not be too small.
187,Just buy it,5,"This is first time i am using iPhone. Initial few days i was missing some feature of my old android phone but now i am loving the iPhone 13. Everything you hear on youtube about iPhone 13 is true, it’"
188,I just loved it it is an awesome phone and a investment for your 3-4 years atleast for middle class,5,
189,iPhone just rules the world,5,You don’t need to write anything when it comes to iPhone because iPhone just rules the world. Simply amazing… price is too much though. The only disappointing thing is that they have stopped giving pr
190,Is very smooth and fast.,5,"I thought upgrading from 11 to 13 would be a hassle. I could transfer all my data from 11 to 13 very easily, Never even had to connect to a pc or download an app."
191,Fantastic,5,Fantastic red .. just unboxed it so cannot say about anything else . Loved it . Thank you amazon
192,"Please buy, nice phone.",5,"Finally, I gift this mobile to my lovely wife.But it's very difficult to live with one kidney!!!"
193,Intelligent Device,5,"Intelligent device with amazing camera ,display ,multitasking support , battery performance and RAM Management"
194,Awesome one,5,"I actually was using note9 Samsung phone from past 5 Years, I work at corporate so my phone usage is a bit more and this iPhone 13 -beast of a phone is delivering on my expectations more than I though"
195,Wonderful product,5,Go on without any hesitation??
196,Good mobile but high cost,5,1. Camera Quality: good(best??)2. Battery life :Good( best??)3. Performance :Good(best??)4. Touch display :low speed ( not good??)Remaining all are good ??
197,Excellent Phone,5,"Excellent in every aspect, battery life is very good, lasts easily for 1-2 days. Worth buying."
198,awesooooome just go for it.,5,Phone looks good basically the diagonal camera. camera quality awesome. I was using I Phone6 then baught this I phone13.
199,Best phone ever owned period,5,Once you use IPhone you are not going back to android.
200,Amazing Camera and Battery for this Iphone,5,The camera is very good and the battery life is also working nice for me with this Iphone. Latest iphone at the best available price.
201,The best phone out there,5,"Best phone out there. Excellent display, battery that lasts a day for medium to heavy users, good haptics, latest software with wonderful camera. I can’t find any cons with the mobile."
202,Next level product,5,Earlier I was worried about the product after reading some bad reviews about appario but do not worry there is no such thing as this company is fraud what I think is this guys are genuine and my produ
203,Nice,5,
204,Amazing as expected,5,Great overall . First time iOS experience. Nice photos and gaming
205,My first iphone experience,5,Really really awesome model to be in hands..The display has a great variation comparable to the android mobiles.
206,Nice,5,Nice product .fastest delivery by Amazon and thanks to seller for genuine product .
207,bought it for my father today,5,"seems very good, let's see long term the long term use"
208,Super se upar,5,Iphone13 Quality is above all the existing smartphones in the world.
209,Super piece but price if it drops more it could be better I got in good deal,5,The product is superb got two days delivery
210,The premiumness you’ll feel it’s just awesome,5,Just go for it no need any explorer. Best of classRecommend to wait for any offerGot it for 73990
211,Flagship,5,"Came from ANdroid. Android has its own perks. But as a daily driver and for doing simple tasks and click pics at go, its a reliab"
212,Good camera and battery,5,Too good camera and battery life
213,Great Performance,5,Good Display... Fast performance... Great battery life for an iPhone.
214,Amazing,5,It’s very nice good quality and the best it has value for money
215,"Connectivity is good,",5,"iPhone 13 is good connectivity and sound clarity, good experience, photo quality is good,"
216,PREMIUM PHONE,5,Best in offering
217,All great as expected,5,Everything was perfect delivery was on time and product delivered perfect. All in all a good experience.
218,Superb Product,5,Nice User Experience
219,Value for money,5,I bought this i phone 13 in summer sale with a very good price and got an excellent product with set delivery date.. absolutely no issues...
220,Great Phone.,5,"Faster Face ID, great battery life, awesome picture quality and new cinematic mode."
221,Quality is good but battery life is not so good and charging is slow compare to One+ Mobiles,5,Don't like Battery life and Charging is very slow compare to One+ Mobiles
222,Upgrade,5,"If you're running an iPhone 11, any of the models in that range, then, yes, the iPhone 13 is definitely worth an upgrade."
223,Best ever iPhone,5,
224,BEST PHONE,5,THIS IS THE BEST SMART PHONE I HAVE USED
225,best,5,
226,Nice,5,Nice product and packaging
227,Amazing phone…,5,Absolutely amazing phone and its worth all the money. Good battery life and very smooth.
228,I brought yesterday from Amazon through Appario... everything is good only,5,
229,Excellent,5,As Expected iphone rocks.. High price
230,Apple is always my first choice,5,Best in quality and feature too
231,Thank you so much Amazon for fast delivery.,5,Superb battery Backup and value for money.
232,Awesome look,5,Nice
233,Worth switching from android to IoS,5,You are not paying for a phone but you are paying for the experience and picture quality
234,Perfect,5,Face id works smoothly and battery life is good
235,I Phone 13 blue color Unboxing,5,
236,Good,5,Good
237,BEST,5,Best in the line ??
238,Good Product,5,Good Product
239,The best phone for the price!,5,Loved the experience of owning the iPhone 13. A massive upgrade over the older generation of iPhones
240,Excellent Buy????,5,Just love the colour and performance as we all know ;) Every thing is just top notch????.
241,Nice product,5,Nice product
242,Awesome,5,As expected
243,Smooth value for money,5,Good productCamera is superbSmoothness is of next levelFeeling proud and feel honor
244,Wow,5,First phone amazing
245,Worth the switch from using Android based smartphone,5,"Liking the device from all the aspects (battery life, performance, software)"
246,Awesome Phone,5,Superb phone
247,Isse jordr kuch nhi ??,5,Sb jordar hai ??
248,Awesome Phone!,5,Battery life -Awesome!Photo quality -SuperbVery nice phone to use.
249,Nice product,5,Go for it .
250,Overall good but not like ultra,5,
251,Nice,5,
252,Best product ever,5,I am upgrade with newer version once they have it
253,Great performance and battery life,5,Battery life is extra ordinary. Performance is better.
254,Worth the price,5,Worth the price
255,Good one,5,
256,Good product ????,5,
257,It’s a great phone,5,Loved it
258,Best camera,5,Great filling
259,iPhone 13 is so cool,5,Battery backup is too good
260,The best offer in Town ??,5,"Superb product, wonderful offer. Thank you"
261,Overall Quite good,5,"Value for money , quite good performance"
262,Nice ????,5,
263,Best camera,5,Portrait mode amazing especially on video
264,Best Phone,5,Best Phone.
265,Wonderful purchase,5,Worth product
266,"Wonderful product,, great battery backup!!",5,Got delivered in 1.5days. Amazing Amazon!!
267,You will never disappointed,5,Overall good buy
268,Good one,5,Perfect
269,Parfect fiting,5,Parfect fiting
270,Best purchase,5,Great product
271,It's just a phone,5,An expensive one.
272,It’s worth it,5,Worth every penny
273,Worth money product,5,Worth money product
274,Ok .,5,Ok
275,Simply Wowwwww..,5,Simply Wowwwww..
276,Camera,5,Like
277,Very good phone just like butter cut by knife life smooth.,5,Very good phone
278,Good phone,5,Let’s see how it work
279,Nice mobile,5,Mobile nice
280,Loved it,5,Amazing phone
281,iPhone always best,5,Mostly liked
282,Good one,5,Good phone
283,Nice,5,Nice
284,Cute little thing ??,5,Purely loved it ??
285,Amazing product,5,Nice product
286,iPhone!,5,It’s worthy!
287,Just switch to i??,5,Awesome ??
288,Worth of the money,5,Nice product!
289,Bought it in 60k after exchange.,5,Worth every penny.
290,Good product,5,I like it
291,Unbelievable battery life and display!!,5,"Upgraded from 8 plus to 13, so far I lovee the camera settings and it’s display, the battery life is something I didn’t expect from specially Iphone, the charge cycle is unbelievable!! If I charge my phone in the morning then it’s good to go for an entire day to use it!! I’m glad I purchased it!"
292,Amazing Phone,5,"Those who are saying, it's just iPhone 12 with design change, then you're wrong,And most of them are upgrading to 13 will have older devices.First thing you notice is the battery backup, it is amazing, at least 3hrs more sot than 12.Main 12MP camera now has bigger sensor , fast auto focus and sensor"
293,Good mobile,5,
294,Incredible Package,5,Was using 11 before this. Wanted to go for 13 pro. Wished 120 hertz pro motion display in my phone. But that costed way too much. Nevertheless this standard 13 model is not too behind. Almost same cameras. Amazing battery life and speakers. And build is similar to 12 offourse but functionality is be
295,Superb phone but greedy Apple,5,Phone is excellent. IOS is very smooth. Battery backup excellent. The problem lies with the accessories that you will be forced to purchase. There is no charger. (Additional Rs. 1900 for apple charger). The cable is type c to lightning. (Additional Rs. 1000 for certified belkin usb to lightning cabl
296,Awesome Product from Apple !!!,5,Actually I am Android user since 10 Years & Now I Switched to Iphone Yes its little difficult to adjust and comfortable with iphone it's take almost 1 week to friendly with themOtherwise I am Student so as a student usage The Battery gives me almost 1.5 Days with once full charge & No Doubt Performa
297,Solid phone overall,5,"I was looking to buy a new smartphone after my POCO F1 started having issues. If you are someone like my who's looking to move from Android to iOS, don't think twice and go ahead with the purchase. I got the phone on release day and the experience so far has been hassle free. If you have any other A"
298,Apple quality is good. Though it's costly. Apple quality is good. Though it's costly.,5,"Apple iphone quality is good. Battery life is good initially, hope it remains same for some time. Money wise all apple products are costly."
299,AMAZING PIECE OF TECH,5,this thing is absolute beast in battery when compared to other iPhone's. I used note 20 ultra before and i am getting nearly the same battery life with this phone in this perfect shape. I am super happy about my purchase. The camera is really great with some new features. if u are looking for a new
300,Must buy,5,Such a great battery life….i have charged it in the morning 10:00 am for 45mins it lasted till midnight with 15% left at 2:00am i really love this service. The camera is like awesome with cinematic mode.
301,I saw in nearby stores,5,I saw in nearby storesIt looks almost like iphone 12 except camera positionBoth the phones are awesomeWhoever is having money can go for itBut people like me can see in stores
302,Great Flagship Phone,5,"The price is directly proportional to the features. Everything is perfect no issues. If you want to switch to an iPhone, this is the perfect phone."
303,Its really awesome bokkeh mode on video is really like next level,5,
304,Awesome,5,Bestest phone there is no comparison of iphone with any other phone. Specially for picture quality. Look wise also good I’m having blue colour I didn’t like that colour but white and black colour was not available at that moment that’s why i go for blue one.. well blue is also good.
305,Next level Phone I shifted from android to iOS just felt amazing..????,5,Mind blowing phone next level photography and camera quality infact battery life is also inproved much Its value for money no doubt
306,Excellent device.,5,Good product and using for personal use. The device is working well.Not facing any glitches. Highly recommended product for everyone .
307,Not for Crybabies,5,First of all all those chapri who gonna buy it from emi will cry that it is same like iPhone 12 and doesn't have adaptor.Lol then why you bought this??
308,amazing,5,love the phone... its amazing the camera quality is so good...apple never disappoints.. though people with iPhone 12 wouldn't find anything new
309,Better battery life & performance ??,5,
310,It's very good storage,5,It's good phone more stora it's camera and well only nice phone iPhone 13 it's better and all good Apple
311,Good but expensive,5,"I phone 13 having lot of good features but difficulties for sr people..missing home button, no call recording, need to buy c type charger etc.."
312,Iphone 13 product red,5,Best phone ever . I was using iphone 12 but now I had upgrade to 13 thanks Amazon thank a lot
313,Touch is best,5,"Touch & video quality awesome,Face lock is superBattery is very goodSound quality is awesomeColour is cool…,"
314,Very nice product,5,Battery camera smooth touch awesome white colour best colour I am very impressed with the quality of the product ..
315,Expensive but worth to buy,5,"I have purchased my first Iphone every.I can say camera is best in market (Vivo v70 pro+ is biggest competitor), Build quality is good with lots of new feature.if you are iphone 12 user, I will not suggest to you. Because there is no much difference between 12 and 13.But if you are purchasing new ip"
316,iPhone 13 is amazing.,5,
317,Mind blowing purchase,5,This is first time iam using an Apple smartphone and iam completely satisfied with this product in Major areas with compare to other android devices and this is the next level experience of using iPhone 13 service device
318,Awesome,5,Superb mobile from Apple.
319,One of the best smartphone.,5,Improved camera.Very Impressive battery.The screen is much brighter.
320,Exquisite experience,5,Pretty Pink Color with amazing features apple has added to the new phone!Feels very light while holding the phone!Happy customer ??
321,Same as 12 only,5,
322,great,5,I am having a great exprience with it after upgrading from my Xr . It feels lighter than my Xr too & find the display really Crisp as earlier i was using an LCD display
323,Great phone,5,"After iPhone 4, I am going back to the Apple ecosystem, by purchasing iPhone 13. In the meantime I have used several Android and Windows phones. This is the best, though at a much higher cost. The battery life is a surprise, with a good life of over almost two days, with normal use."
324,It’s a Gem at the moment in the market.,5,"I wanted to upgrade from iPhone 7 to latest and I believe I did right in purchasing iPhone 13. Very happy with look and feel , Performance and Battery"
325,"Good phone and aawesome camera, but way too expensive",5,"The phone is really good and the response is better than my earlier iphone11. Camera is fab and the cinematic mode really do the magic. However, it is too expensive for the price, which is mainly bcoz of the Apple brand. Also, Apple not providing charger for environment purposes, is fake and I do no"
326,Excellent,5,iPhone 13 looks awesome with great performance and good camera quality totally liked it.
327,Best phone????,5,
328,Good switch from Android to IOS,5,"If you are switching from qndroid to iso, then this is a good decision. Excellent battery life and camera. Just go for it."
329,"Awesome phone , thanks Amazon for awesome delivery",5,"iPhone 13 awesome phone , screen ultra clear, sound very clear too good , Amazon delivery was awesome as always , iPhone rocks.Phone is having 60hz but it doesn’t look like that , easily compare to 90hz phone kudos to Apple"
330,Awesome,5,The iPhone 13 is the best iPhone ever. Fantastic phone. The best camera. Fastest processor. And offcourse a status symbol. Go for it. It's the best smart phone.
331,Great experience ..,5,It’s a great upgrade…camera is good..
332,Premium mobile phone,5,"The defention of flagship has to go to apple products, the premium quality both exterior and interior makes this phone the best in the world.I wish the import tax are not so much ....if we get the same price as the US this will be very fair to all the customers...But the difference of paying 30 to 4"
333,Beast in the House,5,Everyone is a Gangster until a real Gangster comes into the room.Loved the product.
334,Best iPhone I have had in a while,5,Best iPhone I have had in a while
335,Nice product,5,I get iphone 13 thanks amazon
336,Very Good,5,Value for money
337,"Good but, bit expensive.",5,
338,It’s good ??,5,The midnight colour is little bit like navy blue and besides all the things are good and also I like the new cinematic mode of it.It’s good
339,Great Update from iPhone 7 Plus,5,Great to use! Has an amazing camera. Quite light and looks stylish.
340,Its an amazing phone,5,Its an phone that feels differently in hand as compared to other phones. Absolutely amazing camera quality. The one of the best.
341,Amazing experience,5,My first iphone
342,Best Phone Ever,5,This phone has AMAZING FEATURES idk why people hate it this deserves to be liked more as the phone even has CINEMATIC MODE perfect for people who make movies
343,Iphone,5,I switched from Oneplus 5t to iPhone 13. The reasons I switched was 1. Battery life of Oneplus 5t deteriorated rapidly and OnePlus hardly cared to explain this. I also suspected that OnePlus deliberately created a bug that led to sudden drop in battery life. 2. Wanted to get an Android phone but cou
344,Red colour looks stunning!!,5,"Just received this in the morning. My mother loves the red colour. Also, the camera’s pretty impressive. Haven’t tested the battery yet. But, I’m sure it’s much better than the previous versions.The best part is that Red colour’s not flashy."
345,Highly recommended.,5,I always wanted to buy an iPhone this one is just made for me it's has a very good camera and I just love the look.If you are going for iphone than I highly recommend this phone to you other than other than 12 or 11.
346,Awesome,5,Night mode is good and other performance also awesome..Battery performance also good and gaming performance also awesome and camera quality also nice.
347,OnePlus 6T to iPhone 13,5,"I switched from OnePlus 6T to iPhone 13. Just a fabulous mobile. Amazing camera just like a DSLR in pocket. I purchased my iPhone 13 from iPrime store because of same price online & offline. Bought it at ? 81,800.00 (iPhone+ 20w adapter)."
348,Buy 4 this phone in 1lac my all family members are happy,5,"I have no money to buy this ph , i am poor guy, kind hearted person can gift a i phone any model no problem . May god bless you ????????"
349,Fabulous!,5,"Thanks to Amazon, the device was received well packed and before time! The device is fabulous, it's like love at first sight! It doesn't feel like a 2018 device, the speed, the sensors, the touch is pretty amazing! A12 Bionic works well! 3GB RAM is sufficient to run the phone, COD, BGMI and NFS can"
350,Amazing Phone n Excellent service by amazon,5,The Product is amazing n It is Amazon Verified n Best seller so plz dont worry n buy it
351,Getting original product,5,I am very afraid to buy it on Amazon and from Appario due to many negative reviews. But finally ordered it. I got original product. I also wrote this review by my new iPhone XR. I have no any problems till date.Packaging should be better. I am not happy by the packaging of Appario. Go for it don’t f
352,I hate amazon,5,No doubt the product is amazing but I hate the fact that I got this for 41k and now all of a sudden there is a sale and this is selling for 32k and 11 is 36k im really dissatisfied with my purchase now
353,Awesome,5,"Its exactly the same that you buy from store. No adapter for charging, only cable. Ignore the back cover, i bought it separately."
354,Value for money,5,Tight on the budget but still wanna experience all the features of new iPhone.Grab this XR.
355,"Awesome Phone, Amazing Amazon",5,I have used iphone 6s before 1 year. And i was using top of the line Android mobile since last year. Still i was missing my iPhone experience. Then I ordered iPhone XR from Amazon and i got it before expected time and in a very good quality. This is the product which never let u down. Highly recomme
356,Best Flagship Phone Under 35000,5,"35000 ????? ??? ?? ??? ?? ???? ????? ?? ???? ??, ?? ?? Android ?? Iphone ??? ??? ????? ??, ?????? ??? ?? ??? ?? ???? ??, online ???? ?? ???? ?????? ????? ?? , store par ???? ???? ???? ?????? ??, online ?? ???????? 35000 ??? best iPhone ever......."
357,Value for money phone,5,"Good option at 42k for 128gb variant.Fav feature is processor itself. User friendly like android. Battery back up not upto std. value for money phone. No LED display but It’s superb. Camera is good at this range, no night mode. Better build quality (hardware). No Touch ID facility in this phone."
358,Great phone even in 2022…watch my video review,5,
359,Best iPhone : Value for Money .,5,
360,Worth buying in 2021,5,
361,Just fab!!!!!,5,"Just incredible, the main reason is the battery life of iphone XR which is the best compared to all other models. The red colour is just so good, camera is fab overall XR is amazing be it any colour but my personal favourite is the red one."
362,An impressive purchase,5,"I have bought this one for my mum and she’s absolutely delighted with it. I got a great deal during Great Indian Amazon sale. Even in 2021 going into 2022 for anyone looking for a ‘budget’ iphone , this is highly recommended over iPhone SE due to larger screen and user experience."
363,Iphone XR - value for money,5,"128GB for 40Kvalue for moneyonly one camera, neat and clean-Love the old round design-apart from camera and its TFT screen, i dont see any diff for iphone 13 as look and operation is same.battery back up is good- comes 1.5 dayCamera is good but not as iphone 13display is good but not bright as iphon"
364,Best smartphone in ?32k,5,"Upgraded from iPhone 7. Loving this masterpiece.Pros:Best battery backup - goes 20+ hours for me.Big screen, face ID is superquick.Supports latest iOSSame as iPhone 11 except one less camera and A12 chip.Stereo Speakers - sounds like a bluetooth speaker.Cons:Single Rear Camera - doesn’t support Stag"
